<?xml version="1.0" encoding="UTF-8"?>

<Seasons xmlns:xsi="http://www.w3.org/2001/XMLSchema-instance" xsi:noNamespaceSchemaLocation="Seasons.xsd">

	<!-- ========================================================================================================================== -->
	<!-- Season 1 -->
	<!-- ========================================================================================================================== -->

	<Season>
		<Name>SML Season 1</Name>
		<Rank>
			<Name>Grandmaster</Name>
			<Player>
				<DisplayName>Nebula</DisplayName>
				<Status>Active</Status>
				<PlayerID>1</PlayerID>
			</Player>
			<Player>
				<DisplayName>Rov</DisplayName>
				<Status>Active</Status>
				<PlayerID>2</PlayerID>
			</Player>
			<Player>
				<DisplayName>OpiWrites</DisplayName>
				<Status>Active</Status>
				<PlayerID>1</PlayerID>
			</Player>
			<Player>
				<DisplayName>Sauerkraut</DisplayName>
				<Status>Active</Status>
				<PlayerID>1</PlayerID>
			</Player>
			<Player>
				<DisplayName>Miniorek</DisplayName>
				<Status>Active</Status>
				<PlayerID>1</PlayerID>
			</Player>
			<Player>
				<DisplayName>Pofke</DisplayName>
				<Status>Active</Status>
				<PlayerID>1</PlayerID>
			</Player>
			<Player>
				<DisplayName>Turnipboy</DisplayName>
				<Status>Active</Status>
				<PlayerID>1</PlayerID>
			</Player>
			<Player>
				<DisplayName>Koopa</DisplayName>
				<Status>Forfeit</Status>
				<PlayerID>1</PlayerID>
			</Player>
			<!-- Add more players as needed -->
		</Rank>
		<Rank>
			<Name>Master</Name>
			<Player>
				<DisplayName>Adafheyesh</DisplayName>
				<Status>Active</Status>
				<PlayerID>3</PlayerID>
			</Player>
			<Player>
				<DisplayName>Dampsquib</DisplayName>
				<Status>Active</Status>
				<PlayerID>4</PlayerID>
			</Player>
			<Player>
				<DisplayName>C-RAMS</DisplayName>
				<Status>Active</Status>
				<PlayerID>1</PlayerID>
			</Player>
			<Player>
				<DisplayName>Sheph</DisplayName>
				<Status>Active</Status>
				<PlayerID>1</PlayerID>
			</Player>
			<Player>
				<DisplayName>Martini</DisplayName>
				<Status>Active</Status>
				<PlayerID>1</PlayerID>
			</Player>
			<Player>
				<DisplayName>Zerodoom</DisplayName>
				<Status>Active</Status>
				<PlayerID>1</PlayerID>
			</Player>
			<Player>
				<DisplayName>Monaters</DisplayName>
				<Status>Forfeit</Status>
				<PlayerID>1</PlayerID>
			</Player>
			<Player>
				<DisplayName>Pwndnoob</DisplayName>
				<Status>Forfeit</Status>
				<PlayerID>1</PlayerID>
			</Player>
			<!-- Add more players as needed -->
		</Rank>
		<Rank>
			<Name>Ruby</Name>
			<Player>
				<DisplayName>Wrestler</DisplayName>
				<Status>Active</Status>
				<PlayerID>3</PlayerID>
			</Player>
			<Player>
				<DisplayName>Graash</DisplayName>
				<Status>Active</Status>
				<PlayerID>4</PlayerID>
			</Player>
			<Player>
				<DisplayName>Guggie</DisplayName>
				<Status>Active</Status>
				<PlayerID>1</PlayerID>
			</Player>
			<Player>
				<DisplayName>Nanthelas</DisplayName>
				<Status>Active</Status>
				<PlayerID>1</PlayerID>
			</Player>
			<Player>
				<DisplayName>Banana Bread</DisplayName>
				<Status>Active</Status>
				<PlayerID>1</PlayerID>
			</Player>
			<Player>
				<DisplayName>Beanie</DisplayName>
				<Status>Active</Status>
				<PlayerID>1</PlayerID>
			</Player>
			<Player>
				<DisplayName>Slappydavis</DisplayName>
				<Status>Active</Status>
				<PlayerID>1</PlayerID>
			</Player>
			<Player>
				<DisplayName>DavidW</DisplayName>
				<Status>Forfeit</Status>
				<PlayerID>1</PlayerID>
			</Player>
			<!-- Add more players as needed -->
		</Rank>
		<Rank>
			<Name>Emerald</Name>
			<Player>
				<DisplayName>Scout</DisplayName>
				<Status>Active</Status>
				<PlayerID>3</PlayerID>
			</Player>
			<Player>
				<DisplayName>Hunu</DisplayName>
				<Status>Active</Status>
				<PlayerID>4</PlayerID>
			</Player>
			<Player>
				<DisplayName>AstatineEffect</DisplayName>
				<Status>Active</Status>
				<PlayerID>1</PlayerID>
			</Player>
			<Player>
				<DisplayName>Verdruss</DisplayName>
				<Status>Active</Status>
				<PlayerID>1</PlayerID>
			</Player>
			<Player>
				<DisplayName>Sykosloth</DisplayName>
				<Status>Active</Status>
				<PlayerID>1</PlayerID>
			</Player>
			<Player>
				<DisplayName>gENTleman</DisplayName>
				<Status>Active</Status>
				<PlayerID>1</PlayerID>
			</Player>
			<Player>
				<DisplayName>iggythegrifter</DisplayName>
				<Status>Active</Status>
				<PlayerID>1</PlayerID>
			</Player>
			<Player>
				<DisplayName>June</DisplayName>
				<Status>Forfeit</Status>
				<PlayerID>1</PlayerID>
			</Player>
			<!-- Add more players as needed -->
		</Rank>
		<Rank>
			<Name>Sapphire</Name>
			<Player>
				<DisplayName>Calamay</DisplayName>
				<Status>Active</Status>
				<PlayerID>3</PlayerID>
			</Player>
			<Player>
				<DisplayName>Hornet</DisplayName>
				<Status>Active</Status>
				<PlayerID>4</PlayerID>
			</Player>
			<Player>
				<DisplayName>Roxo</DisplayName>
				<Status>Active</Status>
				<PlayerID>1</PlayerID>
			</Player>
			<Player>
				<DisplayName>Catnip</DisplayName>
				<Status>Active</Status>
				<PlayerID>1</PlayerID>
			</Player>
			<Player>
				<DisplayName>Yosh</DisplayName>
				<Status>Active</Status>
				<PlayerID>1</PlayerID>
			</Player>
			<Player>
				<DisplayName>AiCoVT</DisplayName>
				<Status>Active</Status>
				<PlayerID>1</PlayerID>
			</Player>
			<Player>
				<DisplayName>Lavinuke</DisplayName>
				<Status>Active</Status>
				<PlayerID>1</PlayerID>
			</Player>
			<Player>
				<DisplayName>BYE</DisplayName>
				<Status>Active</Status>
				<PlayerID>1</PlayerID>
			</Player>
			<!-- Add more players as needed -->
		</Rank>
		<Rank>
			<Name>Topaz</Name>
			<Player>
				<DisplayName>OneHoppingBunny</DisplayName>
				<Status>Active</Status>
				<PlayerID>3</PlayerID>
			</Player>
			<Player>
				<DisplayName>bloodredyeti</DisplayName>
				<Status>Active</Status>
				<PlayerID>4</PlayerID>
			</Player>
			<Player>
				<DisplayName>iSkate4PlanB</DisplayName>
				<Status>Forfeit</Status>
				<PlayerID>1</PlayerID>
			</Player>
			<Player>
				<DisplayName>Coding</DisplayName>
				<Status>Forfeit</Status>
				<PlayerID>1</PlayerID>
			</Player>
			<!-- Add more players as needed -->
		</Rank>
	</Season>

	<!-- ========================================================================================================================== -->
	<!-- Season 2 -->
	<!-- ========================================================================================================================== -->
	
	<Season>
		<Name>SML Season 2</Name>
		<Rank>
			<Name>Grandmaster</Name>
			<Player>
				<DisplayName>Nebula</DisplayName>
				<Status>Active</Status>
				<PlayerID>1</PlayerID>
			</Player>
			<Player>
				<DisplayName>Rov</DisplayName>
				<Status>Active</Status>
				<PlayerID>2</PlayerID>
			</Player>
			<Player>
				<DisplayName>OpiWrites</DisplayName>
				<Status>Active</Status>
				<PlayerID>1</PlayerID>
			</Player>
			<Player>
				<DisplayName>Sauerkraut</DisplayName>
				<Status>Active</Status>
				<PlayerID>1</PlayerID>
			</Player>
			<Player>
				<DisplayName>Miniorek</DisplayName>
				<Status>Active</Status>
				<PlayerID>1</PlayerID>
			</Player>
			<Player>
				<DisplayName>Pofke</DisplayName>
				<Status>Active</Status>
				<PlayerID>1</PlayerID>
			</Player>
			<Player>
				<DisplayName>Turnipboy</DisplayName>
				<Status>Active</Status>
				<PlayerID>1</PlayerID>
			</Player>
			<!-- Add more players as needed -->
		</Rank>
		<Rank>
			<Name>Master</Name>
			<Player>
				<DisplayName>Adafheyesh</DisplayName>
				<Status>Active</Status>
				<PlayerID>3</PlayerID>
			</Player>
			<Player>
				<DisplayName>Dampsquib</DisplayName>
				<Status>Active</Status>
				<PlayerID>4</PlayerID>
			</Player>
			<Player>
				<DisplayName>C-RAMS</DisplayName>
				<Status>Active</Status>
				<PlayerID>1</PlayerID>
			</Player>
			<Player>
				<DisplayName>Sheph</DisplayName>
				<Status>Active</Status>
				<PlayerID>1</PlayerID>
			</Player>
			<Player>
				<DisplayName>Martini</DisplayName>
				<Status>Active</Status>
				<PlayerID>1</PlayerID>
			</Player>
			<Player>
				<DisplayName>Zerodoom</DisplayName>
				<Status>Active</Status>
				<PlayerID>1</PlayerID>
			</Player>
			<Player>
				<DisplayName>Monaters</DisplayName>
				<Status>Active</Status>
				<PlayerID>1</PlayerID>
			</Player>
			<!-- Add more players as needed -->
		</Rank>
		<Rank>
			<Name>Ruby</Name>
			<Player>
				<DisplayName>Wrestler</DisplayName>
				<Status>Active</Status>
				<PlayerID>3</PlayerID>
			</Player>
			<Player>
				<DisplayName>Graash</DisplayName>
				<Status>Active</Status>
				<PlayerID>4</PlayerID>
			</Player>
			<Player>
				<DisplayName>Guggie</DisplayName>
				<Status>Active</Status>
				<PlayerID>1</PlayerID>
			</Player>
			<Player>
				<DisplayName>Nanthelas</DisplayName>
				<Status>Active</Status>
				<PlayerID>1</PlayerID>
			</Player>
			<Player>
				<DisplayName>Banana Bread</DisplayName>
				<Status>Active</Status>
				<PlayerID>1</PlayerID>
			</Player>
			<Player>
				<DisplayName>Beanie</DisplayName>
				<Status>Active</Status>
				<PlayerID>1</PlayerID>
			</Player>
			<Player>
				<DisplayName>Slappydavis</DisplayName>
				<Status>Active</Status>
				<PlayerID>1</PlayerID>
			</Player>
			<!-- Add more players as needed -->
		</Rank>
		<Rank>
			<Name>Emerald</Name>
			<Player>
				<DisplayName>Scout</DisplayName>
				<Status>Active</Status>
				<PlayerID>3</PlayerID>
			</Player>
			<Player>
				<DisplayName>Hunu</DisplayName>
				<Status>Active</Status>
				<PlayerID>4</PlayerID>
			</Player>
			<Player>
				<DisplayName>AstatineEffect</DisplayName>
				<Status>Active</Status>
				<PlayerID>1</PlayerID>
			</Player>
			<Player>
				<DisplayName>Verdruss</DisplayName>
				<Status>Active</Status>
				<PlayerID>1</PlayerID>
			</Player>
			<Player>
				<DisplayName>Sykosloth</DisplayName>
				<Status>Active</Status>
				<PlayerID>1</PlayerID>
			</Player>
			<Player>